project_name,repository_url,commit_hash,parent_commit_hash,author,date,message,variability_bug,bug_probability,matched_features,files_changed,build_system_affected,impact_scope,feature_scope,json_source_file,repo_dir
ksmbd,https://github.com/namjaejeon/ksmbd,b1d3849162bfe2cc7022e52f190b2efced2017de,2276b2b290336e81432c3680a35e2d02ecabd54e,Namjae Jeon,2020-01-19,"smbd: fix empty macro issue from smbd_debug\n\nSebastian Gottschall report and suggestion solution like the following.\n\nexample:\nif (rc)\nsmbd_debug(""test);\nfree(somepointer);\n\nwhat will happen if smbd_debug is a empty macro?\nfree will be never called unless rc is non zero. there are various\nlocations in smbd where this condition will trigger. so smbd will\nnot compiled correct if CONFIG_SMB_SERVER_DEBUGGING is disabled\n\n-#define smbd_debug(fmt, ...)\n+#define smbd_debug(fmt, ...) do { } while(0)\n\nis the solution.\n\nSigned-off-by: Namjae Jeon <linkinjeon@gmail.com>",1,0.9997448325157166,SMB_SERVER,glob.h,0,other,other,ksmbd.json,repos/ksmbd
ksmbd,https://github.com/namjaejeon/ksmbd,2166531867fa50d58958c6364a0552bcd131996f,764366d7cb891c2bd49515d8fd9523dc643a3816,Namjae Jeon,2020-04-17,ksmbd: release 3.1.7 version\n\n- override fsuid/fsgid in current credential\n- add SMB_SERVER_CHECK_CAP_NET_ADMIN config option\n- add follow symlink parameter support\n- fix lease smbtorture tests\n\nSigned-off-by: Namjae Jeon <namjae.jeon@samsung.com>,1,0.999466836452484,"SMB_SERVER, SMB_SERVER_CHECK_CAP_NET_ADMIN",glob.h,0,other,other,ksmbd.json,repos/ksmbd
ksmbd,https://github.com/namjaejeon/ksmbd,51bb048bb108f250f22fd3b0c6b18a5a6315201a,45e81e2a743b3928b2542614308a56a5f314722e,Namjae Jeon,2021-01-09,cifsd: release 3.3.3 version\n\nThe Marjor changes are:\n - fix xfstests issues on life test.\n - improve credentials codes.\n - enable SMB_SERVER_CHECK_CAP_NET_ADMIN by default.\n\nSigned-off-by: Namjae Jeon <namjae.jeon@samsung.com>,1,0.7598607540130615,"SMB_SERVER, SMB_SERVER_CHECK_CAP_NET_ADMIN",glob.h,0,other,other,ksmbd.json,repos/ksmbd
ksmbd,https://github.com/namjaejeon/ksmbd,20f590673748a475e625b6522cced67a5f046516,63fd211cd4a8d25c8ce0d1f49ac94ecc452145d8,Namjae Jeon,2021-03-19,cifsd: fix WARNING: unmet direct dependencies detected for CRYPTO_ARC4\n\nRandy reported warning message from fs/cifsd/Kconfig.\n\nWARNING: unmet direct dependencies detected for CRYPTO_ARC4\n  Depends on [n]: CRYPTO [=y] && CRYPTO_USER_API_ENABLE_OBSOLETE [=n]\n  Selected by [y]:\n  - SMB_SERVER [=y] && NETWORK_FILESYSTEMS [=y] && INET [=y]\n\narc4 library is not currently in use. So this patch eliminates\nunnecessary library set in cifsd.\n\nReported-by: Randy Dunlap <rdunlap@infradead.org>\nSigned-off-by: Namjae Jeon <namjae.jeon@samsung.com>,1,0.9997074007987976,SMB_SERVER,"Kconfig, server.c",1,build system,other,ksmbd.json,repos/ksmbd
ksmbd,https://github.com/namjaejeon/ksmbd,7e758146beb3cf821a960cccba776156392d2e22,09a593545c515d7cb474467ace383ee7077128e5,Zhang Xiaoxu,2021-04-07,"cifsd: Select SG_POOL for SMB_SERVER_SMBDIRECT\n\nhulk-robot following build error:\n fs/cifsd/transport_rdma.c: In function 'read_write_done':\n fs/cifsd/transport_rdma.c:1297:2: error: implicit declaration of\nfunction 'sg_free_table_chained'\n[-Werror=implicit-function-declaration]\n  1297 |  sg_free_table_chained(&msg->sgt, SG_CHUNK_SIZE);\n\nThe reason is CONFIG_SG_POOL is not enabled in the config, to\navoid such failure, select SG_POOL in Kconfig for SMB_SERVER_SMBDIRECT.\n\nSigned-off-by: Zhang Xiaoxu <zhangxiaoxu5@huawei.com>\nSigned-off-by: Namjae Jeon <namjae.jeon@samsung.com>\nSigned-off-by: Steve French <stfrench@microsoft.com>",1,0.9951735138893129,"SMB_SERVER, SMB_SERVER_SMBDIRECT",Kconfig,1,build system,other,ksmbd.json,repos/ksmbd
ksmbd,https://github.com/namjaejeon/ksmbd,8bb8fb405ff735704693fc9d00ea512c094c92d9,05936da8518d5a9256ac68c154aae24572aa6ed3,Namjae Jeon,2021-12-20,ksmbd: fix incorrect le conversion\n\nFix incorrect le conversions and capsule __ksmbd_auth_ntlmv2() with\nCONFIG_SMB_INSECURE_SERVER.\n\nSigned-off-by: Namjae Jeon <linkinjeon@kernel.org>,1,0.9997155070304872,SMB_INSECURE_SERVER,"auth.c, smb1pdu.c",0,other,other,ksmbd.json,repos/ksmbd
ksmbd,https://github.com/namjaejeon/ksmbd,71f0c7e5f86e835212bd84fa2a5c3972169de896,ac478bb574592c326b8c784c2aec9f170c53f095,Hyunchul Lee,2022-07-30,"ksmbd: fix build errors with linux-5.4\n\nWhen CONFIG_SMB_SERVER_SMBDIRECT is enabled,\nBuild failed with the errors below:\n\ntransport_rdma.c:1922:45: error: ‘struct ib_device_attr’ has no member\nnamed ‘max_sgl_rd’; did you mean ‘max_sge_rd’?\n 1922 |  if (pages_per_rw > t->cm_id->device->attrs.max_sgl_rd) {\n      |                                             ^~~~~~~~~~\n      |                                             max_sge_rd\n\ntransport_rdma.c:2177:9: error: initialization of\n‘void (*)(struct ib_device *)’ from incompatible pointer type\n‘int (*)(struct ib_device *)’ [-Werror=incompatible-pointer-types]\n 2177 |  .add = smb_direct_ib_client_add,\n      |         ^~~~~~~~~~~~~~~~~~~~~~~~\n\nSigned-off-by: Hyunchul Lee <hyc.lee@gmail.com>\nSigned-off-by: Namjae Jeon <linkinjeon@kernel.org>",1,0.9997197985649108,"SMB_SERVER, SMB_SERVER_SMBDIRECT",transport_rdma.c,0,other,other,ksmbd.json,repos/ksmbd
