project_name,repository_url,commit_hash,parent_commit_hash,author,date,message,variability_bug,bug_probability,matched_features,files_changed,build_system_affected,impact_scope,feature_scope,json_source_file,repo_dir
OpenPicoRTOS,https://github.com/jnaulet/OpenPicoRTOS,1b45c26f13773af4535edc6eac259db93d3bd75f,427a77e8d2f63f431d86e1d65d7568978c7e4c1f,rickxxxblaine,2023-03-19,demo: raspberry-pico-SMP API change fix,1,0.998206377029419,SMP,demo/raspberry-pico-SMP/main.c,0,other,other,OpenPicoRTOS.json,repos/OpenPicoRTOS
OpenPicoRTOS,https://github.com/jnaulet/OpenPicoRTOS,36c42b0441eaa176a23449d1091b7c4573f888f9,f637e0b03818971a71ccc44f7efc5fbcd5a2268f,Joachim Naulet,2023-09-05,demo: fixed Arduinio AVR platforms,1,0.9997203946113586,AVR,"demo/arduino-mega2560/Makefile, demo/arduino-uno/Makefile, demo/arduino-uno/main.c",1,build system,other,OpenPicoRTOS.json,repos/OpenPicoRTOS
OpenPicoRTOS,https://github.com/jnaulet/OpenPicoRTOS,20d6b3eac1abf68118503b1a823486b288d4f5c4,bcabc5cf8ca320b358dfb98f6b8a54770191fa0d,Joachim Naulet,2024-06-24,spi: fixed non-irq driven AVR spi driver,1,0.9997261166572572,AVR,"drivers/spi/spi-avr.c, drivers/spi/spi-avr.h, drivers/spi/spi-avr_irqdriven.c",0,other,other,OpenPicoRTOS.json,repos/OpenPicoRTOS
OpenPicoRTOS,https://github.com/jnaulet/OpenPicoRTOS,b3bc49ee3fd683c63b97082454c961b09aae9965,30ea1aa57fab169f562d07c5d42c8e4fcbc5a4cb,Joachim Naulet,2024-05-27,8051: n76e003 device fix,1,0.999726951122284,8051,arch/8051/mach-n76e003/picoRTOS_device.h,0,other,other,OpenPicoRTOS.json,repos/OpenPicoRTOS
OpenPicoRTOS,https://github.com/jnaulet/OpenPicoRTOS,06412d19e497219fda5d80f84d377dcada793202,0cc356417efe45585937631adbab791e62dd27ed,Joachim Naulet,2024-05-27,8051: fixed ports to use hdr2asm new script,1,0.9997329115867616,8051,"arch/8051/mach-cy7c6801xa/picoRTOS_device.inc, arch/8051/mach-cy7c6801xa/timer-t2.c, arch/8051/mach-mcs51/timer-t2.c, arch/8051/mach-n76e003/picoRTOS_device.h, arch/8051/mach-n76e003/picoRTOS_device.inc, arch/8051/mach-n76e003/timer-t2.c, arch/8051/mach-n76e003/timer-wkt.c, arch/8051/mach-stc12c5axx/picoRTOS_device.h, arch/8051/mach-stc12c5axx/picoRTOS_device.inc, arch/8051/mach-stc12c5axx/timer-t0.c, arch/8051/mach-ucsim_51/picoRTOS_device.h, arch/8051/mach-ucsim_51/picoRTOS_device.inc, arch/8051/picoRTOS_portasm.S, arch/8051/picoRTOS_types.h",0,other,other,OpenPicoRTOS.json,repos/OpenPicoRTOS
OpenPicoRTOS,https://github.com/jnaulet/OpenPicoRTOS,edcb3c5a1b1ea26a9dfe1787df41d6c5192216b1,a767086bbe14baef0466a760b73f0725d93d59b1,Joachim Naulet,2024-10-08,8051: cypress / ez-usb-fx2 timer idle fix,1,0.999717891216278,8051,"arch/8051/mach-cy7c6801xa/timer-t2.c, arch/8051/mach-n76e003/timer-wkt.c",0,other,other,OpenPicoRTOS.json,repos/OpenPicoRTOS
